{
    "identifier": "estompage",
    "title": "Estompage",
    "abstract": "Estompage Azimuth 315Â°",
    "keywords": ["MNT"],
    "legend": {
        "format": "image/png",
        "url": "http://ign.fr",
        "height": 100,
        "width": 100,
        "min_scale_denominator": 0,
        "max_scale_denominator": 30
    },
    "estompage": {
        "zenith": 45,
        "azimuth": 315,
        "z_factor": 1,
        "interpolation": "linear"
    },
    "palette": {
        "no_alpha": false,
        "rgb_continuous": true,
        "alpha_continuous": true,
        "colours": [
            { "value": 0, "red": 0, "green": 0, "blue": 0, "alpha": 64 },
            { "value": 255, "red": 255, "green": 255, "blue": 255, "alpha": 64 }
        ]
    }
}
