{
	"identifier": "aspect",
    "title": "Aspect",
	"abstract": "Calcul de l'exposition par la m√©thode de Horn",
	"keywords": ["MNT"],
    "legend": {
        "format": "image/png",
        "url": "http://ign.fr",
        "height": 100,
        "width": 100,
        "min_scale_denominator": 0,
        "max_scale_denominator": 30
    },
    "exposition": {
        "algo": "H",
        "min_slope": 1
    },
    "palette": {
        "rgb_continuous": true,
        "alpha_continuous": true,
        "no_alpha": false,
        "colours": [
            { "value": -1.0, "red": 255, "green": 255, "blue": 255, "alpha": 0 },
            { "value": 0, "red": 224, "green": 32, "blue": 29, "alpha": 200 },
            { "value": 22.5, "red": 224, "green": 32, "blue": 29, "alpha": 200 },
            { "value": 22.6, "red": 230, "green": 142, "blue": 28, "alpha": 200 },
            { "value": 67.5, "red": 230, "green": 142, "blue": 28, "alpha": 200 },
            { "value": 67.6, "red": 255, "green": 112, "blue": 18, "alpha": 200 },
            { "value": 112.5, "red": 255, "green": 112, "blue": 18, "alpha": 200 },
            { "value": 112.6, "red": 219, "green": 199, "blue": 14, "alpha": 200 },
            { "value": 157.5, "red": 219, "green": 199, "blue": 14, "alpha": 200 },
            { "value": 157.6, "red": 11, "green": 215, "blue": 230, "alpha": 200 },
            { "value": 202.5, "red": 11, "green": 215, "blue": 230, "alpha": 200 },
            { "value": 202.6, "red": 14, "green": 113, "blue": 199, "alpha": 200 },
            { "value": 247.5, "red": 14, "green": 113, "blue": 199, "alpha": 200 },
            { "value": 247.6, "red": 50, "green": 50, "blue": 235, "alpha": 200 },
            { "value": 292.5, "red": 50, "green": 50, "blue": 235, "alpha": 200 },
            { "value": 292.6, "red": 222, "green": 27, "blue": 141, "alpha": 200 },
            { "value": 337.5, "red": 222, "green": 27, "blue": 141, "alpha": 200 },
            { "value": 337.6, "red": 224, "green": 32, "blue": 29, "alpha": 200 },
            { "value": 360.0, "red": 224, "green": 32, "blue": 29, "alpha": 200 }
        ]
    }
}