{
	"identifier": "normal",
    "title": "Données brutes",
	"abstract": "Données brutes, sans modification de canal",
	"keywords": ["Défaut"],
    "legend": {
        "format": "image/jpeg",
        "url": "https://data.geopf.fr/annexes/ressources/legendes/LEGEND.jpg",
        "height": 69,
        "width": 280,
        "min_scale_denominator": 200,
        "max_scale_denominator": 100000000
    }
}
